<?xml version="1.0" encoding="UTF-8"?>

<valorant_state xmlns:xsi="http://www.w3.org/2001/XMLSchema-instance"
    xsi:noNamespaceSchemaLocation="xvalo.xsd">

    <ranks>
        <rank>
            <name>Immortal</name>
            <divisions>1 2 3</divisions> <!-- list -->
            <image src="server/iamge">immortal</image>
            <playerbase_percent>3%</playerbase_percent>
        </rank>
        <rank>
            <name>Radiant</name>
            <divisions>1</divisions> <!-- list -->
            <image src="server/iamge">radiant</image>
            <playerbase_percent>2%</playerbase_percent>
        </rank>
    </ranks>
    <teams>
        <team id="team-1">
            <name>Team 1</name>
            <players>
                <player id="player-1" active="yes">
                    <username gametag="1234">Player 1</username>
                    <player_rank division="1">Gold</player_rank>
                    <server avg_ping="20">EU</server>
                    <personal_info access="prohibited">
                        <fullname>Adam Sandler</fullname>
                        <age>28</age>
                        <!-- <age>dwadzie≈õcia</age> -->
                        <country>Poland</country>
                    </personal_info>
                    <socials>
                        <link url="https://twitter.com/">Twitter | X</link>
                        <link url="https://instagram.com/">Instagram</link>
                        <link url="https://facebook.com/">Facebook</link>
                    </socials>
                    <favourites>
                        <weapon>
                            <name>Phantom</name>
                            <skin src="server/iamge" upgraded="yes">Prime</skin>
                        </weapon>
                        <agent>Jett</agent>
                        <mouse>Logitech G Pro</mouse>
                        <!-- <tablet>Wacom Intuos Pro</tablet> -->
                        <keyboard>Logitech G Pro</keyboard>
                        <monitor model="XL2546">
                            <name>BenQ Zowie</name>
                            <size>27"</size>
                            <panel sync_tech="G-Sync">IPS</panel>
                            <resolution>2560 x 1440</resolution>
                            <refresh_rate>240Hz</refresh_rate>
                        </monitor>
                    </favourites>
                    <experience>562354</experience>
                </player>
            </players>
        </team>
    </teams>
    <tournaments>
        <tournament>
            <name>Valorant Masters<edition>1</edition>
            </name>
            <location>Reykjavik, Iceland</location>
            <date>
                <start>2021-05-24</start>
                <end>2021-05-30</end>
            </date>
            <prize_pool currency="PLN">600,000</prize_pool>
            <teams>
                <team id="team_1">
                    <name>Team 1</name>
                </team>
                <team id="team_2">
                    <name>Team 2</name>
                </team>
            </teams>
        </tournament>
    </tournaments>
</valorant_state>